{"acceptanceControl":{"archiveLifecycleCommit":"00d15f18e51141645cb6fa04b837139ad9a0c6f3","formalResultPresent":false,"formalVerdictPresent":false,"implementationRevision":"b56ce858733b18875df3101a423c6d1b356eed54"},"actionsEvidence":{"conclusion":"success","headRevision":"111bc57b15d16a4aadf155ee503bc12c8065caef","headTree":"4489591ae54ea3b71e4ba86e41d935065276113e","runId":"30264329846"},"applicationVersion":"v0.1.0","authorities":{"buildDefinitions":[{"path":"backend/scripts/build-artifact.sh","sha256":"sha256:aaaaaaaaaaaaaaaaaaaaaaaaaaaaaaaaaaaaaaaaaaaaaaaaaaaaaaaaaaaaaaaa"}],"contracts":[{"path":"contracts/artifacts/schemas/build-statement-v1.schema.json","sha256":"sha256:bbbbbbbbbbbbbbbbbbbbbbbbbbbbbbbbbbbbbbbbbbbbbbbbbbbbbbbbbbbbbbbb"}],"priorDevelopmentArtifacts":{"reusePolicy":"ephemeral-ci-output-is-not-a-reusable-operations-input","status":"not-materialized-for-authorized-closure"},"toolchains":[{"identityDigest":"sha256:cccccccccccccccccccccccccccccccccccccccccccccccccccccccccccccccc","name":"node","version":"24.18.0"}]},"frozenProduct":{"revision":"3f585cfe0a0dd61fe783a839528fef25470a58db","tree":"93e29a0c51c0305db8a43e7d029b8eaa3014a1b8"},"lifecycleStatus":"development-acceptance-closed-by-authorized-ci-and-remote-evidence","operationsBase":{"revision":"fdbe98772cdf6294ee94ba9b3ce5d0126e4d8444","tree":"3f0a830ebb38ed7351a7f7d9d8bafa0d3510d999"},"remoteEvidence":{"audit":{"p0Findings":0,"p1Findings":0},"cleanup":{"buildCacheBytesAfter":0,"legacyResourceDriftCount":0,"temporarySourceArchiveRemoved":true,"validationRootRemoved":true},"exceptions":[{"classification":"platform-specific-process-identity","expectedPlatform":"darwin","id":"runner/escaped-fixture-fallback","observedPlatform":"linux","rationale":"The selected test asserts Darwin process identity formatting and is not portable to the isolated Linux runner."}],"runtime":{"architecture":"amd64","nodeVersion":"24.18.0","npmVersion":"11.16.0","platform":"linux"},"sourceArchiveSha256":"sha256:9ce38b792dbbcf8dc6992122ee5af4cdfcfc3914214497108980e01672b4ed14","supervisorTests":{"passed":21,"total":21},"targetedTests":{"passed":82,"total":83},"unexecutedFormalCells":["archive/full","browser/oracle","performance/budget"]},"schemaVersion":"operations-authorization-input-v1"}
